Task ID,Title,Description,Category,Priority,Status,Assignee,Estimated Hours,Due Date,Created Date,Updated Date,Tags,Dependencies,Source Section,Notion Page ID,Manus Task ID
hldd_section_032_task_41,timeline and success metrics provide clear guidance for development teams while establishing accountability for delivering the transformational capabilities that DIMIA enables. This integration plan establishes the foundation for Bio-Quantum AI's evolution into the definitive next-generation trading platform that defines the future of financial technology.,"From HLDD Section: Conclusion

Context: The detailed implementation timeline and success metrics provide clear guidance for development teams while establishing accountability for delivering the transformational capabilities that DIMIA enables. This integration plan establishes the foundation for Bio-Quantum AI's evolution into the definitive next-generation trading platform that defines the future of financial technology.",implementation,low,pending,,,,2025-07-07T03:44:53.974066,2025-07-07T03:44:53.974067,"hldd, imported",,section_032,,
hldd_section_003_task_2,Strategy](#implementation-strategy),"From HLDD Section: Table of Contents

Context: 7. [Implementation Strategy](#implementation-strategy)",implementation,low,pending,,,,2025-07-07T03:44:53.974076,2025-07-07T03:44:53.974077,"hldd, imported",,section_003,,
hldd_section_006_task_3,". Unlike static integration frameworks that require constant maintenance and updates, DIMIA evolves organically, becoming more valuable and sophisticated as it matures.","From HLDD Section: Evolutionary Advantages

Context: This biological foundation creates a living system that grows more intelligent and capable with each interaction. Unlike static integration frameworks that require constant maintenance and updates, DIMIA evolves organically, becoming more valuable and sophisticated as it matures.",implementation,low,pending,,,,2025-07-07T03:44:53.974083,2025-07-07T03:44:53.974085,"hldd, imported",,section_006,,
hldd_section_012_task_4,"layer enables the Bio-Quantum AI platform to communicate with diverse systems using a unified protocol, simplifying development and maintenance while ensuring robust error handling and retry logic.","From HLDD Section: Codon Structure and Composition

Context: The API wrapper functionality provides a consistent interface for interacting with external platforms regardless of their underlying API structure. This abstraction layer enables the Bio-Quantum AI platform to communicate with diverse systems using a unified protocol, simplifying development and maintenance while ensuring robust error handling and retry logic.",implementation,high,in_progress,,,,2025-07-07T03:44:53.974092,2025-07-07T03:44:53.974093,"hldd, imported",,section_012,,
hldd_section_012_task_5,s on any connected platform are immediately reflected across the entire ecosystem.,"From HLDD Section: Codon Structure and Composition

Context: Event handling mechanisms provide real-time synchronization between platforms. Codons can respond to events such as order executions, price alerts, and strategy signals, ensuring that users receive timely updates regardless of which platform generated the event. This creates a unified experience where actions on any connected platform are immediately reflected across the entire ecosystem.",implementation,high,in_progress,,,,2025-07-07T03:44:53.974099,2025-07-07T03:44:53.974100,"hldd, imported",,section_012,,
hldd_section_014_task_6,". New trading platforms, data providers, and analytical tools can be integrated quickly, ensuring that Bio-Quantum AI users always have access to the latest and most effective tools available in the market.","From HLDD Section: Dynamic Loading and Activation

Context: The dynamic nature of the codon system enables rapid adaptation to changing market conditions and user requirements. New trading platforms, data providers, and analytical tools can be integrated quickly, ensuring that Bio-Quantum AI users always have access to the latest and most effective tools available in the market.",implementation,low,pending,,,,2025-07-07T03:44:53.974106,2025-07-07T03:44:53.974107,"hldd, imported",,section_014,,
hldd_section_017_task_7,", performance characteristics, and user feedback from similar integrations.","From HLDD Section: Intelligent Binding and Activation

Context: When the discovery agent identifies a potential integration opportunity, it initiates an intelligent binding process that evaluates compatibility, security, and user benefit. The agent accesses the knowledge codex to retrieve detailed information about the target platform, including integration requirements, performance characteristics, and user feedback from similar integrations.",implementation,low,pending,,,,2025-07-07T03:44:53.974115,2025-07-07T03:44:53.974117,"hldd, imported",,section_017,,
hldd_section_017_task_8,"are approved for integration, protecting users from potential security vulnerabilities.","From HLDD Section: Intelligent Binding and Activation

Context: Security evaluation is a critical component of the binding process. The discovery agent analyzes the security posture of target platforms, reviewing their authentication methods, data encryption standards, and privacy policies. Only platforms that meet Bio-Quantum AI's stringent security requirements are approved for integration, protecting users from potential security vulnerabilities.",implementation,high,in_progress,,,,2025-07-07T03:44:53.974123,2025-07-07T03:44:53.974124,"hldd, imported",,section_017,,
hldd_section_018_task_9,.,"From HLDD Section: User Interaction and Consent Management

Context: The consent management system provides granular control over data sharing and integration scope. Users can specify exactly what information should be shared between platforms and under what circumstances. This fine-grained control ensures that users can customize their integration experience to match their specific privacy preferences and workflow requirements.",implementation,low,pending,,,,2025-07-07T03:44:53.974130,2025-07-07T03:44:53.974131,"hldd, imported",,section_018,,
hldd_section_019_task_10,"and engagement with each integration. Metrics such as usage frequency, feature utilization, and user feedback are analyzed to identify opportunities for improvement. This data informs future development priorities and helps optimize the integration experience for all users.","From HLDD Section: Continuous Monitoring and Optimization

Context: The monitoring system also tracks user satisfaction and engagement with each integration. Metrics such as usage frequency, feature utilization, and user feedback are analyzed to identify opportunities for improvement. This data informs future development priorities and helps optimize the integration experience for all users.",implementation,medium,pending,,,,2025-07-07T03:44:53.974137,2025-07-07T03:44:53.974138,"hldd, imported",,section_019,,
hldd_section_021_task_11,"and available integrations, ensuring optimal compatibility and performance.","From HLDD Section: Taxonomic Organization and Classification

Context: Secondary classifications consider technical factors such as API protocols, authentication methods, data formats, and performance characteristics. This multi-dimensional classification system enables precise matching between user requirements and available integrations, ensuring optimal compatibility and performance.",implementation,low,pending,,,,2025-07-07T03:44:53.974149,2025-07-07T03:44:53.974151,"hldd, imported",,section_021,,
hldd_section_021_task_12,. This contextual information enables personalized integration recommendations that align with each user's specific needs and constraints.,"From HLDD Section: Taxonomic Organization and Classification

Context: The taxonomic structure also incorporates user-specific context, including experience level, trading style, geographic location, and regulatory requirements. This contextual information enables personalized integration recommendations that align with each user's specific needs and constraints.",implementation,low,pending,,,,2025-07-07T03:44:53.974157,2025-07-07T03:44:53.974158,"hldd, imported",,section_021,,
hldd_section_022_task_13,scores.,"From HLDD Section: Metadata Management and Enrichment

Context: Each integration entry in the knowledge codex includes comprehensive metadata that describes its capabilities, requirements, and characteristics. Technical metadata includes API documentation, authentication requirements, rate limits, and data schemas. Performance metadata tracks response times, reliability metrics, and user satisfaction scores.",implementation,low,pending,,,,2025-07-07T03:44:53.974164,2025-07-07T03:44:53.974168,"hldd, imported",,section_022,,
hldd_section_022_task_14,", and characteristics. Technical metadata includes API documentation, authentication requirements, rate limits, and data schemas. Performance metadata tracks response times, reliability metrics, and user satisfaction scores.","From HLDD Section: Metadata Management and Enrichment

Context: Each integration entry in the knowledge codex includes comprehensive metadata that describes its capabilities, requirements, and characteristics. Technical metadata includes API documentation, authentication requirements, rate limits, and data schemas. Performance metadata tracks response times, reliability metrics, and user satisfaction scores.",implementation,low,pending,,,,2025-07-07T03:44:53.974174,2025-07-07T03:44:53.974175,"hldd, imported",,section_022,,
hldd_section_024_task_15,"metrics provide insights into the real-world effectiveness of different integrations. These metrics include usage frequency, feature utilization, and explicit user feedback. The analytics system identifies patterns and trends that inform future development and optimization efforts.","From HLDD Section: Performance Analytics and Optimization

Context: User satisfaction metrics provide insights into the real-world effectiveness of different integrations. These metrics include usage frequency, feature utilization, and explicit user feedback. The analytics system identifies patterns and trends that inform future development and optimization efforts.",implementation,medium,pending,,,,2025-07-07T03:44:53.974184,2025-07-07T03:44:53.974185,"hldd, imported",,section_024,,
hldd_section_026_task_16,"data, timing patterns, and feature utilization to build comprehensive user profiles that inform integration decisions.","From HLDD Section: Behavioral Analysis and Pattern Recognition

Context: The AI Decision Engine continuously analyzes user behavior patterns to understand individual preferences, workflows, and optimization opportunities. Advanced machine learning algorithms process interaction data, timing patterns, and feature utilization to build comprehensive user profiles that inform integration decisions.",implementation,low,pending,,,,2025-07-07T03:44:53.974191,2025-07-07T03:44:53.974192,"hldd, imported",,section_026,,
hldd_section_026_task_17,"sequences that can be optimized through intelligent integration management. For example, if a user consistently performs technical analysis in one platform before executing trades in another, the AI can suggest automated data synchronization or workflow integration to streamline the process.","From HLDD Section: Behavioral Analysis and Pattern Recognition

Context: Pattern recognition capabilities identify recurring workflows and common task sequences that can be optimized through intelligent integration management. For example, if a user consistently performs technical analysis in one platform before executing trades in another, the AI can suggest automated data synchronization or workflow integration to streamline the process.",implementation,low,pending,,,,2025-07-07T03:44:53.974198,2025-07-07T03:44:53.974200,"hldd, imported",,section_026,,
hldd_section_030_task_18,", and platform capabilities. The engine can automatically adjust integration configurations based on geographic location, regulatory changes, or platform updates to ensure compliance and optimal performance.","From HLDD Section: Contextual Intelligence and Personalization

Context: Contextual intelligence extends beyond individual preferences to consider broader market context, regulatory requirements, and platform capabilities. The engine can automatically adjust integration configurations based on geographic location, regulatory changes, or platform updates to ensure compliance and optimal performance.",implementation,low,pending,,,,2025-07-07T03:44:53.974205,2025-07-07T03:44:53.974207,"hldd, imported",,section_030,,
hldd_section_031_task_19,"of the DNA-Inspired Middleware Integration Architecture requires a carefully planned, phased approach that ensures system stability while enabling rapid capability expansion. The strategy balances technical complexity with user value delivery, prioritizing core functionality while building toward the full vision of an adaptive, intelligent integration ecosystem.","From HLDD Section: Implementation Strategy {#implementation-strategy}

Context: The implementation of the DNA-Inspired Middleware Integration Architecture requires a carefully planned, phased approach that ensures system stability while enabling rapid capability expansion. The strategy balances technical complexity with user value delivery, prioritizing core functionality while building toward the full vision of an adaptive, intelligent integration ecosystem.",implementation,low,pending,,,,2025-07-07T03:44:53.974214,2025-07-07T03:44:53.974216,"hldd, imported",,section_031,,
hldd_section_032_task_20,"phase focuses on establishing the core infrastructure components that will support the entire DIMIA framework. This includes developing the basic codon structure, implementing the discovery agent scanning capabilities, and creating the initial knowledge codex database schema.","From HLDD Section: Phase 1: Foundation Infrastructure

Context: The initial implementation phase focuses on establishing the core infrastructure components that will support the entire DIMIA framework. This includes developing the basic codon structure, implementing the discovery agent scanning capabilities, and creating the initial knowledge codex database schema.",architecture,low,pending,,,,2025-07-07T03:44:53.974222,2025-07-07T03:44:53.974223,"hldd, imported",,section_032,,
hldd_section_032_task_21,.,"From HLDD Section: Phase 1: Foundation Infrastructure

Context: The foundation phase prioritizes stability and security, implementing robust authentication frameworks, secure communication protocols, and comprehensive error handling mechanisms. These foundational elements ensure that subsequent development phases can build upon a solid, reliable base that meets enterprise-grade security and performance requirements.",architecture,low,pending,,,,2025-07-07T03:44:53.974229,2025-07-07T03:44:53.974230,"hldd, imported",,section_032,,
hldd_section_033_task_22,s and performance characteristics to ensure that each codon meets Bio-Quantum AI's stringent quality standards.,"From HLDD Section: Phase 2: Core Codon Development

Context: Quality assurance during this phase includes extensive compatibility testing across different operating systems, browsers, and device types. The testing process also validates security implementations and performance characteristics to ensure that each codon meets Bio-Quantum AI's stringent quality standards.",implementation,low,pending,,,,2025-07-07T03:44:53.974236,2025-07-07T03:44:53.974238,"hldd, imported",,section_033,,
hldd_section_034_task_23,"s such as data caching and request prioritization, gradually expanding to more sophisticated decision-making capabilities.","From HLDD Section: Phase 3: AI Engine Integration

Context: The third phase introduces the AI Decision Engine capabilities, beginning with basic behavioral analysis and pattern recognition. Initial AI functionality focuses on simple optimization tasks such as data caching and request prioritization, gradually expanding to more sophisticated decision-making capabilities.",integration,low,pending,,,,2025-07-07T03:44:53.974244,2025-07-07T03:44:53.974247,"hldd, imported",,section_034,,
hldd_section_034_task_24,.,"From HLDD Section: Phase 3: AI Engine Integration

Context: Machine learning model development during this phase leverages anonymized user data to train algorithms for integration recommendation and performance optimization. The development process includes comprehensive privacy protections and user consent mechanisms to ensure ethical AI implementation.",integration,low,pending,,,,2025-07-07T03:44:53.974255,2025-07-07T03:44:53.974257,"hldd, imported",,section_034,,
hldd_section_036_task_25,"phase focuses on expanding the integration ecosystem and introducing innovative capabilities that differentiate Bio-Quantum AI from competitors. This includes developing integrations with emerging platforms, implementing cutting-edge technologies such as blockchain connectivity, and introducing novel features such as cross-platform strategy sharing.","From HLDD Section: Phase 5: Ecosystem Expansion and Innovation

Context: The final implementation phase focuses on expanding the integration ecosystem and introducing innovative capabilities that differentiate Bio-Quantum AI from competitors. This includes developing integrations with emerging platforms, implementing cutting-edge technologies such as blockchain connectivity, and introducing novel features such as cross-platform strategy sharing.",implementation,low,pending,,,,2025-07-07T03:44:53.974263,2025-07-07T03:44:53.974264,"hldd, imported",,section_036,,
hldd_section_044_task_26,of modular codons that self-assemble based on environmental scanning and AI-driven decision making creates a unique technical solution to integration challenges.,"From HLDD Section: Core Patentable Innovations

Context: The fundamental concept of using DNA-inspired structures for software integration represents a novel approach that meets patent requirements for novelty, non-obviousness, and utility. The specific implementation of modular codons that self-assemble based on environmental scanning and AI-driven decision making creates a unique technical solution to integration challenges.",implementation,low,pending,,,,2025-07-07T03:44:53.974335,2025-07-07T03:44:53.974336,"hldd, imported",,section_044,,
hldd_section_044_task_27,"for novelty, non-obviousness, and utility. The specific implementation of modular codons that self-assemble based on environmental scanning and AI-driven decision making creates a unique technical solution to integration challenges.","From HLDD Section: Core Patentable Innovations

Context: The fundamental concept of using DNA-inspired structures for software integration represents a novel approach that meets patent requirements for novelty, non-obviousness, and utility. The specific implementation of modular codons that self-assemble based on environmental scanning and AI-driven decision making creates a unique technical solution to integration challenges.",implementation,low,pending,,,,2025-07-07T03:44:53.974345,2025-07-07T03:44:53.974347,"hldd, imported",,section_044,,
hldd_section_045_task_28,"patents that protect key technical innovations. Foundational patents should cover the overall DIMIA architecture, the biological metaphor application to software integration, and the core concepts of self-assembling connector modules.","From HLDD Section: Patent Portfolio Strategy

Context: A comprehensive patent portfolio should include both broad foundational patents and specific implementation patents that protect key technical innovations. Foundational patents should cover the overall DIMIA architecture, the biological metaphor application to software integration, and the core concepts of self-assembling connector modules.",implementation,medium,pending,,,,2025-07-07T03:44:53.974352,2025-07-07T03:44:53.974354,"hldd, imported",,section_045,,
hldd_section_045_task_29,"patents should protect specific technical innovations such as the discovery agent's scanning algorithms, the knowledge codex's taxonomic organization system, and the AI Decision Engine's real-time optimization processes. These patents provide protection for the specific technical approaches that enable DIMIA's capabilities.","From HLDD Section: Patent Portfolio Strategy

Context: Implementation patents should protect specific technical innovations such as the discovery agent's scanning algorithms, the knowledge codex's taxonomic organization system, and the AI Decision Engine's real-time optimization processes. These patents provide protection for the specific technical approaches that enable DIMIA's capabilities.",implementation,medium,pending,,,,2025-07-07T03:44:53.974360,2025-07-07T03:44:53.974361,"hldd, imported",,section_045,,
hldd_section_047_task_30,of elements in the DIMIA architecture creates a novel system that merits patent protection.,"From HLDD Section: Prior Art Analysis and Differentiation

Context: The combination of multiple innovative elements into a cohesive framework further strengthens the patent position. Even if individual components might have some prior art, the specific combination and interaction of elements in the DIMIA architecture creates a novel system that merits patent protection.",implementation,low,pending,,,,2025-07-07T03:44:53.974367,2025-07-07T03:44:53.974368,"hldd, imported",,section_047,,
hldd_section_049_task_31,"of secure authentication frameworks for external platform connections, and development of the initial user interface for integration management. The quarter concludes with a functional prototype that demonstrates basic codon loading and activation.","From HLDD Section: Q3 2025: Foundation and Core Infrastructure

Context: Key deliverables for this quarter include the completion of the discovery agent's basic scanning capabilities, implementation of secure authentication frameworks for external platform connections, and development of the initial user interface for integration management. The quarter concludes with a functional prototype that demonstrates basic codon loading and activation.",architecture,low,pending,,,,2025-07-07T03:44:53.974374,2025-07-07T03:44:53.974375,"hldd, imported",,section_049,,
hldd_section_050_task_32,"provides simple optimization features such as intelligent caching and request prioritization, establishing the foundation for more sophisticated capabilities in future quarters.","From HLDD Section: Q4 2025: Initial Codon Library and AI Foundation

Context: AI development during this quarter focuses on basic behavioral analysis and pattern recognition capabilities. The initial AI implementation provides simple optimization features such as intelligent caching and request prioritization, establishing the foundation for more sophisticated capabilities in future quarters.",implementation,medium,pending,,,,2025-07-07T03:44:53.974381,2025-07-07T03:44:53.974383,"hldd, imported",,section_050,,
hldd_section_051_task_33,"of advanced caching strategies, distributed processing capabilities, and scalability improvements that prepare the system for broader user adoption and increased integration complexity.","From HLDD Section: Q1 2026: Advanced AI and Ecosystem Expansion

Context: Performance optimization becomes a focus during this quarter, with implementation of advanced caching strategies, distributed processing capabilities, and scalability improvements that prepare the system for broader user adoption and increased integration complexity.",implementation,medium,pending,,,,2025-07-07T03:44:53.974389,2025-07-07T03:44:53.974390,"hldd, imported",,section_051,,
hldd_section_052_task_34,.,"From HLDD Section: Q2 2026: Enterprise Features and Community Platform

Context: The second quarter focuses on developing enterprise-grade features that enable large-scale deployments and institutional use cases. This includes implementing advanced security features, compliance tools, and administrative capabilities that meet enterprise requirements.",implementation,low,pending,,,,2025-07-07T03:44:53.974396,2025-07-07T03:44:53.974401,"hldd, imported",,section_052,,
hldd_section_054_task_35,"strategy balances rapid value delivery with long-term vision, ensuring that users benefit from DIMIA capabilities quickly while building toward the full potential of an adaptive, intelligent integration ecosystem. The patent portfolio protects key innovations while creating licensing opportunities and strategic value.","From HLDD Section: Conclusion

Context: The implementation strategy balances rapid value delivery with long-term vision, ensuring that users benefit from DIMIA capabilities quickly while building toward the full potential of an adaptive, intelligent integration ecosystem. The patent portfolio protects key innovations while creating licensing opportunities and strategic value.",implementation,low,pending,,,,2025-07-07T03:44:53.974410,2025-07-07T03:44:53.974411,"hldd, imported",,section_054,,
hldd_section_055_task_36,"s on Database Systems, 1(1), 9-36.","From HLDD Section: References

Context: [5] Chen, P.P. (1976). ""The entity-relationship modeltoward a unified view of data."" ACM Transactions on Database Systems, 1(1), 9-36.",documentation,low,pending,,,,2025-07-07T03:44:53.974420,2025-07-07T03:44:53.974421,"hldd, imported",,section_055,,
