Task ID,Title,Description,Category,Priority,Status,Assignee,Estimated Hours,Due Date,Created Date,Updated Date,Tags,Dependencies,Source Section,Notion Page ID,Manus Task ID
hldd_section_002_task_1,details into the existing HLDD framework while maintaining document coherence and technical accuracy.,"From HLDD Section: Executive Summary

Context: The DNA-Inspired Middleware Integration Architecture (DIMIA) represents a revolutionary advancement that must be integrated into the Bio-Quantum AI High-Level Design Document as a foundational architectural component. This integration plan outlines the comprehensive updates required to incorporate DIMIA concepts, specifications, and implementation details into the existing HLDD framework while maintaining document coherence and technical accuracy.",implementation,low,pending,,,,2025-07-07T03:44:53.973704,2025-07-07T03:44:53.973706,"hldd, imported",,section_002,,
hldd_section_002_task_2,of this revolutionary architecture.,"From HLDD Section: Executive Summary

Context: This integration plan provides detailed specifications for updating each section of the HLDD, ensuring that DIMIA concepts are properly documented, technically accurate, and aligned with existing platform capabilities. The plan also includes recommendations for Notion workspace organization, investor presentation updates, and development team coordination to ensure successful implementation of this revolutionary architecture.",implementation,low,pending,,,,2025-07-07T03:44:53.973717,2025-07-07T03:44:53.973719,"hldd, imported",,section_002,,
hldd_section_004_task_3,.,"From HLDD Section: Section 1: System Overview and Architecture

Context: The system overview should also address how DIMIA integrates with existing platform components including the quantum AI engine, real-time trading systems, and user interface frameworks. Integration points and data flows between DIMIA components and existing systems must be clearly documented to ensure seamless implementation.",architecture,low,pending,,,,2025-07-07T03:44:53.973727,2025-07-07T03:44:53.973729,"hldd, imported",,section_004,,
hldd_section_005_task_4,", and lifecycle management processes. The documentation should emphasize how codons enable rapid integration with new platforms without requiring core system modifications.","From HLDD Section: Section 2: Core Platform Components

Context: The Modular Codon Framework should be documented as a core platform service that enables dynamic integration capabilities. Technical specifications should include codon structure definitions, interface protocols, security requirements, and lifecycle management processes. The documentation should emphasize how codons enable rapid integration with new platforms without requiring core system modifications.",implementation,medium,in_progress,,,,2025-07-07T03:44:53.973739,2025-07-07T03:44:53.973741,"hldd, imported",,section_005,,
hldd_section_005_task_5,workflows.,"From HLDD Section: Section 2: Core Platform Components

Context: The Discovery Agent should be positioned as an intelligent platform service that continuously enhances platform capabilities through environmental awareness and automatic integration discovery. Documentation should include scanning algorithms, compatibility evaluation processes, security assessment procedures, and user interaction workflows.",implementation,low,pending,,,,2025-07-07T03:44:53.973759,2025-07-07T03:44:53.973760,"hldd, imported",,section_005,,
hldd_section_006_task_6,patterns to create intuitive experiences that leverage familiar biological concepts.,"From HLDD Section: Section 3: User Experience and Interface Design

Context: The User Experience section requires updates to incorporate DIMIA-enabled features and capabilities into the platform's user interface design. The biological metaphor should be reflected in user interface elements and interaction patterns to create intuitive experiences that leverage familiar biological concepts.",integration,low,pending,,,,2025-07-07T03:44:53.973768,2025-07-07T03:44:53.973770,"hldd, imported",,section_006,,
hldd_section_007_task_7,"for dynamic integration systems. The documentation should include audit trails, monitoring capabilities, and reporting mechanisms that enable compliance with financial services regulations while maintaining the flexibility and adaptability of the DIMIA architecture.","From HLDD Section: Section 4: Security and Compliance Framework

Context: Compliance frameworks must be updated to address regulatory requirements for dynamic integration systems. The documentation should include audit trails, monitoring capabilities, and reporting mechanisms that enable compliance with financial services regulations while maintaining the flexibility and adaptability of the DIMIA architecture.",architecture,medium,in_progress,,,,2025-07-07T03:44:53.973777,2025-07-07T03:44:53.973778,"hldd, imported",,section_007,,
hldd_section_008_task_8,that must be carefully documented and managed.,"From HLDD Section: Section 5: Performance and Scalability Specifications

Context: The Performance and Scalability section requires updates to address the performance characteristics and scalability considerations of the DIMIA architecture. The dynamic nature of integration management creates new performance requirements that must be carefully documented and managed.",documentation,low,pending,,,,2025-07-07T03:44:53.973793,2025-07-07T03:44:53.973795,"hldd, imported",,section_008,,
hldd_section_008_task_9,"for integration discovery, activation, and operation. The documentation should address how the DIMIA architecture maintains optimal performance even as the number of active integrations grows significantly.","From HLDD Section: Section 5: Performance and Scalability Specifications

Context: Performance specifications should include response time requirements for integration discovery, activation, and operation. The documentation should address how the DIMIA architecture maintains optimal performance even as the number of active integrations grows significantly.",documentation,medium,in_progress,,,,2025-07-07T03:44:53.973804,2025-07-07T03:44:53.973805,"hldd, imported",,section_008,,
hldd_section_008_task_10,.,"From HLDD Section: Section 5: Performance and Scalability Specifications

Context: Scalability considerations must address how the DIMIA architecture scales to support large numbers of users, integrations, and concurrent operations. The documentation should include capacity planning guidelines, resource allocation strategies, and performance monitoring requirements.",documentation,low,pending,,,,2025-07-07T03:44:53.973814,2025-07-07T03:44:53.973816,"hldd, imported",,section_008,,
hldd_section_009_task_11,", security review procedures, and quality assurance standards. The documentation should ensure that third-party developers can create high-quality codons that integrate seamlessly with the DIMIA framework.","From HLDD Section: Section 6: Development and Deployment Guidelines

Context: Codon development guidelines should include standardized development processes, testing requirements, security review procedures, and quality assurance standards. The documentation should ensure that third-party developers can create high-quality codons that integrate seamlessly with the DIMIA framework.",implementation,high,in_progress,,,,2025-07-07T03:44:53.973822,2025-07-07T03:44:53.973826,"hldd, imported",,section_009,,
hldd_section_009_task_12,", and incident response processes that ensure reliable operation of the DIMIA architecture.","From HLDD Section: Section 6: Development and Deployment Guidelines

Context: Deployment strategies should address how DIMIA components are deployed, updated, and maintained in production environments. The documentation should include rollback procedures, monitoring requirements, and incident response processes that ensure reliable operation of the DIMIA architecture.",implementation,low,pending,,,,2025-07-07T03:44:53.973833,2025-07-07T03:44:53.973837,"hldd, imported",,section_009,,
hldd_section_011_task_13,status tracking.,"From HLDD Section: Workspace Organization and Structure

Context: A dedicated DIMIA section should be created at the top level of the workspace hierarchy, containing subsections for each major component: Modular Codons, Discovery Agent, Knowledge Codex, and AI Decision Engine. Each subsection should include technical specifications, development guidelines, and implementation status tracking.",implementation,low,pending,,,,2025-07-07T03:44:53.973844,2025-07-07T03:44:53.973845,"hldd, imported",,section_011,,
hldd_section_011_task_14,progress and enable effective coordination between development teams.,"From HLDD Section: Workspace Organization and Structure

Context: Project management and tracking sections should be updated to include DIMIA development milestones, testing procedures, and deployment schedules. The workspace should provide clear visibility into DIMIA implementation progress and enable effective coordination between development teams.",implementation,low,pending,,,,2025-07-07T03:44:53.973854,2025-07-07T03:44:53.973855,"hldd, imported",,section_011,,
hldd_section_012_task_15,"guidelines, testing procedures, and user documentation.","From HLDD Section: Documentation Templates and Standards

Context: Standardized documentation templates should be created for DIMIA-related content to ensure consistency and completeness across all documentation. Templates should include sections for technical specifications, implementation guidelines, testing procedures, and user documentation.",documentation,low,pending,,,,2025-07-07T03:44:53.973861,2025-07-07T03:44:53.973862,"hldd, imported",,section_012,,
hldd_section_012_task_16,details. These templates should enable third-party developers to create comprehensive documentation for their codon contributions.,"From HLDD Section: Documentation Templates and Standards

Context: Codon documentation templates should provide standardized formats for documenting integration capabilities, requirements, and implementation details. These templates should enable third-party developers to create comprehensive documentation for their codon contributions.",documentation,medium,in_progress,,,,2025-07-07T03:44:53.973868,2025-07-07T03:44:53.973869,"hldd, imported",,section_012,,
hldd_section_012_task_17,", and implementation details. These templates should enable third-party developers to create comprehensive documentation for their codon contributions.","From HLDD Section: Documentation Templates and Standards

Context: Codon documentation templates should provide standardized formats for documenting integration capabilities, requirements, and implementation details. These templates should enable third-party developers to create comprehensive documentation for their codon contributions.",documentation,medium,in_progress,,,,2025-07-07T03:44:53.973875,2025-07-07T03:44:53.973877,"hldd, imported",,section_012,,
hldd_section_013_task_18,.,"From HLDD Section: Collaboration and Communication Frameworks

Context: Stakeholder communication channels should provide regular updates on DIMIA development progress, milestone achievements, and strategic implications. These channels should ensure that all stakeholders understand the value and impact of DIMIA implementation.",architecture,low,pending,,,,2025-07-07T03:44:53.973883,2025-07-07T03:44:53.973884,"hldd, imported",,section_013,,
hldd_section_013_task_19,based on user feedback and development experience. The Notion workspace should facilitate collection and analysis of feedback to drive continuous improvement.,"From HLDD Section: Collaboration and Communication Frameworks

Context: Feedback and improvement processes should be established to continuously refine DIMIA documentation and implementation based on user feedback and development experience. The Notion workspace should facilitate collection and analysis of feedback to drive continuous improvement.",architecture,medium,in_progress,,,,2025-07-07T03:44:53.973890,2025-07-07T03:44:53.973892,"hldd, imported",,section_013,,
hldd_section_016_task_20,roadmap presentations should show how DIMIA development aligns with overall platform strategy and business objectives. The roadmap should demonstrate clear milestones and deliverables that build investor confidence in execution capabilities.,"From HLDD Section: Technical Demonstration and Proof Points

Context: Implementation roadmap presentations should show how DIMIA development aligns with overall platform strategy and business objectives. The roadmap should demonstrate clear milestones and deliverables that build investor confidence in execution capabilities.",implementation,medium,in_progress,,,,2025-07-07T03:44:53.973898,2025-07-07T03:44:53.973899,"hldd, imported",,section_016,,
hldd_section_019_task_21,"of DIMIA concepts across all platform components. These guidelines should provide detailed specifications for interface design, data structures, and integration protocols.","From HLDD Section: Technical Implementation Guidelines

Context: Development team coordination requires clear technical guidelines that ensure consistent implementation of DIMIA concepts across all platform components. These guidelines should provide detailed specifications for interface design, data structures, and integration protocols.",implementation,medium,in_progress,,,,2025-07-07T03:44:53.973905,2025-07-07T03:44:53.973906,"hldd, imported",,section_019,,
hldd_section_019_task_22,"guidelines should provide detailed requirements for implementing DIMIA security features including authentication, authorization, data protection, and audit logging. These guidelines should ensure that security is built into every aspect of DIMIA implementation.","From HLDD Section: Technical Implementation Guidelines

Context: Security implementation guidelines should provide detailed requirements for implementing DIMIA security features including authentication, authorization, data protection, and audit logging. These guidelines should ensure that security is built into every aspect of DIMIA implementation.",implementation,high,in_progress,,,,2025-07-07T03:44:53.973912,2025-07-07T03:44:53.973913,"hldd, imported",,section_019,,
hldd_section_019_task_23,"for implementing DIMIA security features including authentication, authorization, data protection, and audit logging. These guidelines should ensure that security is built into every aspect of DIMIA implementation.","From HLDD Section: Technical Implementation Guidelines

Context: Security implementation guidelines should provide detailed requirements for implementing DIMIA security features including authentication, authorization, data protection, and audit logging. These guidelines should ensure that security is built into every aspect of DIMIA implementation.",implementation,high,in_progress,,,,2025-07-07T03:44:53.973920,2025-07-07T03:44:53.973921,"hldd, imported",,section_019,,
hldd_section_020_task_24,meets quality and reliability standards. These procedures should address the unique challenges of testing dynamic integration systems while maintaining compatibility with existing platform components.,"From HLDD Section: Testing and Quality Assurance Procedures

Context: Comprehensive testing procedures must be established to ensure that DIMIA implementation meets quality and reliability standards. These procedures should address the unique challenges of testing dynamic integration systems while maintaining compatibility with existing platform components.",testing,medium,pending,,,,2025-07-07T03:44:53.973927,2025-07-07T03:44:53.973928,"hldd, imported",,section_020,,
hldd_section_020_task_25,"maintains optimal platform performance under various load conditions. These requirements should include benchmarking, stress testing, and capacity planning procedures.","From HLDD Section: Testing and Quality Assurance Procedures

Context: Performance testing requirements should ensure that DIMIA implementation maintains optimal platform performance under various load conditions. These requirements should include benchmarking, stress testing, and capacity planning procedures.",testing,medium,pending,,,,2025-07-07T03:44:53.973937,2025-07-07T03:44:53.973938,"hldd, imported",,section_020,,
hldd_section_020_task_26,"should ensure that DIMIA implementation maintains optimal platform performance under various load conditions. These requirements should include benchmarking, stress testing, and capacity planning procedures.","From HLDD Section: Testing and Quality Assurance Procedures

Context: Performance testing requirements should ensure that DIMIA implementation maintains optimal platform performance under various load conditions. These requirements should include benchmarking, stress testing, and capacity planning procedures.",testing,medium,pending,,,,2025-07-07T03:44:53.973944,2025-07-07T03:44:53.973946,"hldd, imported",,section_020,,
hldd_section_021_task_27,. These milestones should align with business objectives while providing technical teams with clear development targets.,"From HLDD Section: Project Management and Milestone Tracking

Context: Milestone definitions should establish clear deliverables and success criteria for each phase of DIMIA implementation. These milestones should align with business objectives while providing technical teams with clear development targets.",project_management,medium,pending,,,,2025-07-07T03:44:53.973952,2025-07-07T03:44:53.973953,"hldd, imported",,section_021,,
hldd_section_021_task_28,". These procedures should address technical risks, resource constraints, and integration challenges that could impact successful delivery.","From HLDD Section: Project Management and Milestone Tracking

Context: Risk management procedures should identify potential challenges and mitigation strategies for DIMIA implementation. These procedures should address technical risks, resource constraints, and integration challenges that could impact successful delivery.",project_management,medium,pending,,,,2025-07-07T03:44:53.973962,2025-07-07T03:44:53.973963,"hldd, imported",,section_021,,
hldd_section_023_task_29,". This phase includes updating all documentation, establishing development frameworks, and preparing teams for implementation.","From HLDD Section: Phase 1: Foundation and Planning (Q3 2025)

Context: The foundation phase focuses on establishing the infrastructure and planning necessary for successful DIMIA implementation. This phase includes updating all documentation, establishing development frameworks, and preparing teams for implementation.",project_management,low,pending,,,,2025-07-07T03:44:53.973971,2025-07-07T03:44:53.973973,"hldd, imported",,section_023,,
hldd_section_023_task_30,. The documentation updates should provide clear guidance for development teams while maintaining accessibility for non-technical stakeholders.,"From HLDD Section: Phase 1: Foundation and Planning (Q3 2025)

Context: HLDD integration should be completed during this phase, ensuring that all platform documentation accurately reflects DIMIA capabilities and requirements. The documentation updates should provide clear guidance for development teams while maintaining accessibility for non-technical stakeholders.",project_management,medium,pending,,,,2025-07-07T03:44:53.973978,2025-07-07T03:44:53.973980,"hldd, imported",,section_023,,
hldd_section_023_task_31,. The workspace should provide intuitive navigation and comprehensive information architecture that supports effective team coordination.,"From HLDD Section: Phase 1: Foundation and Planning (Q3 2025)

Context: Notion workspace reorganization should be completed to accommodate DIMIA documentation and collaboration requirements. The workspace should provide intuitive navigation and comprehensive information architecture that supports effective team coordination.",project_management,medium,pending,,,,2025-07-07T03:44:53.973986,2025-07-07T03:44:53.973987,"hldd, imported",,section_023,,
hldd_section_023_task_32,". This includes establishing testing environments, continuous integration pipelines, and quality assurance procedures.","From HLDD Section: Phase 1: Foundation and Planning (Q3 2025)

Context: Development environment setup should establish the tools, frameworks, and processes necessary for DIMIA implementation. This includes establishing testing environments, continuous integration pipelines, and quality assurance procedures.",project_management,low,pending,,,,2025-07-07T03:44:53.973993,2025-07-07T03:44:53.973996,"hldd, imported",,section_023,,
hldd_section_024_task_33,"should provide the basic infrastructure for creating and managing integration modules. This includes defining codon interfaces, implementing lifecycle management, and establishing security frameworks.","From HLDD Section: Phase 2: Core Component Development (Q4 2025)

Context: Modular codon framework implementation should provide the basic infrastructure for creating and managing integration modules. This includes defining codon interfaces, implementing lifecycle management, and establishing security frameworks.",implementation,high,in_progress,,,,2025-07-07T03:44:53.974003,2025-07-07T03:44:53.974004,"hldd, imported",,section_024,,
hldd_section_024_task_34,"should establish the database infrastructure and taxonomic organization systems that enable intelligent integration management. This includes metadata management, relationship mapping, and performance tracking capabilities.","From HLDD Section: Phase 2: Core Component Development (Q4 2025)

Context: Knowledge codex implementation should establish the database infrastructure and taxonomic organization systems that enable intelligent integration management. This includes metadata management, relationship mapping, and performance tracking capabilities.",implementation,medium,pending,,,,2025-07-07T03:44:53.974010,2025-07-07T03:44:53.974011,"hldd, imported",,section_024,,
hldd_section_029_task_35,across all platform components. These metrics should provide objective measures of system performance while identifying opportunities for optimization and improvement.,"From HLDD Section: Technical Performance Indicators

Context: Technical performance metrics should measure the effectiveness and reliability of DIMIA implementation across all platform components. These metrics should provide objective measures of system performance while identifying opportunities for optimization and improvement.",implementation,medium,pending,,,,2025-07-07T03:44:53.974020,2025-07-07T03:44:53.974021,"hldd, imported",,section_029,,
hldd_section_029_task_36,with discovery capabilities.,"From HLDD Section: Technical Performance Indicators

Context: Integration discovery effectiveness should measure how successfully the discovery agent identifies relevant integration opportunities for users. This includes metrics for discovery accuracy, user adoption of suggested integrations, and user satisfaction with discovery capabilities.",implementation,low,pending,,,,2025-07-07T03:44:53.974027,2025-07-07T03:44:53.974029,"hldd, imported",,section_029,,
hldd_section_029_task_37,"of individual integration modules. This includes response times, error rates, and user engagement with different integration types.","From HLDD Section: Technical Performance Indicators

Context: Codon performance metrics should measure the reliability, performance, and user satisfaction of individual integration modules. This includes response times, error rates, and user engagement with different integration types.",implementation,high,in_progress,,,,2025-07-07T03:44:53.974034,2025-07-07T03:44:53.974036,"hldd, imported",,section_029,,
hldd_section_029_task_38,with AI-driven features.,"From HLDD Section: Technical Performance Indicators

Context: AI decision engine effectiveness should measure how successfully the AI optimizes integration behavior and user experiences. This includes metrics for prediction accuracy, optimization impact, and user satisfaction with AI-driven features.",implementation,low,pending,,,,2025-07-07T03:44:53.974044,2025-07-07T03:44:53.974046,"hldd, imported",,section_029,,
hldd_section_030_task_39,"scores should measure user perception of DIMIA capabilities and their impact on platform value. This includes satisfaction surveys, user feedback analysis, and retention metrics that indicate long-term value creation.","From HLDD Section: User Adoption and Engagement Metrics

Context: User satisfaction scores should measure user perception of DIMIA capabilities and their impact on platform value. This includes satisfaction surveys, user feedback analysis, and retention metrics that indicate long-term value creation.",implementation,medium,pending,,,,2025-07-07T03:44:53.974051,2025-07-07T03:44:53.974053,"hldd, imported",,section_030,,
hldd_section_032_task_40,of this revolutionary architecture.,"From HLDD Section: Conclusion

Context: The biological metaphor provides both intuitive understanding and sophisticated technical capabilities that differentiate Bio-Quantum AI from all competitors. The comprehensive documentation updates, Notion workspace integration, and development coordination frameworks ensure successful implementation of this revolutionary architecture.",implementation,low,pending,,,,2025-07-07T03:44:53.974059,2025-07-07T03:44:53.974060,"hldd, imported",,section_032,,
